{
  "$schema": "http://json-schema.org/draft-07/schema#",
  "$id": "https://github.com/lleonardogr/sphinx-vscode/blob/main/schemas/quiz.schema.json",
  "title": "Sphinx quiz",
  "description": "A set of questions about Java. Lives in <folder>/<quiz-id>/quiz.json. Guide: docs/quizzes.md",
  "type": "object",
  "required": [
    "title",
    "questions"
  ],
  "additionalProperties": false,
  "properties": {
    "$schema": {
      "type": "string"
    },
    "id": {
      "type": "string",
      "pattern": "^[a-z0-9]+(-[a-z0-9]+)*$",
      "description": "Unique id. Defaults to the folder name (recommended: leave it out)."
    },
    "title": {
      "type": "string",
      "minLength": 1,
      "description": "Name shown in the Quizzes group and at the top of the quiz."
    },
    "description": {
      "type": "string",
      "description": "Shown above the questions (Markdown)."
    },
    "language": {
      "enum": ["java", "c"],
      "description": "The language of the \"output\" questions' code. By default, the language of the quiz's unit's subject (C for C Programming units), otherwise Java. Set it for a quiz with no unit, such as an exam's."
    },
    "topic": {
      "type": "string",
      "description": "The unit this quiz belongs to (Basics, Conditionals, Loops, Strings, Methods, Arrays, Collections, OOP, Exceptions, Recursion or Streams); it is listed at the end of that unit. Other values or none: the quiz goes to the Custom section.",
      "examples": [
        "Basics",
        "Conditionals",
        "Loops",
        "Strings",
        "Methods",
        "Arrays",
        "Collections",
        "OOP",
        "Exceptions",
        "Recursion",
        "Streams"
      ]
    },
    "requires": {
      "type": "array",
      "items": {
        "type": "string"
      },
      "description": "Units the student should know first, by unit key (for example \"Loops\" from Java Programming). Shown with the student's progress in each unit; never enforced."
    },
    "subject": {
      "type": "string",
      "description": "The subject (for example \"cs\"), for content without a unit. Otherwise the unit decides the subject."
    },
    "questions": {
      "type": "array",
      "minItems": 1,
      "items": {
        "type": "object",
        "required": [
          "type",
          "answer"
        ],
        "properties": {
          "type": {
            "enum": [
              "choice",
              "truefalse",
              "short",
              "output",
              "number"
            ],
            "enumDescriptions": [
              "Multiple choice. \"answer\" is the index of the right option (0 = first), or a list of indexes when several are right.",
              "True or false. \"answer\" is true or false.",
              "Short answer typed by the student. \"answer\" is an accepted answer or a list of them.",
              "What does this code print? \"answer\" is the exact output (leave it \"\" and run Validate → fill in expected outputs), or an option index when \"options\" is given."
            ],
            "description": "\"number\": a number typed by the student, compared by value (see \"base\" and \"tolerance\")."
          },
          "prompt": {
            "type": "string",
            "description": "The question (Markdown). Optional for \"output\" (defaults to \"What does this code print?\")."
          },
          "code": {
            "type": "string",
            "description": "Code shown with the question. For \"output\" it is compiled and run by the validator: a Java snippet is wrapped in void main() { … }, a C snippet in int main(void) { … } with <stdio.h>, <stdlib.h>, <string.h> and <stdint.h> included."
          },
          "language": {
            "enum": ["java", "c"],
            "description": "For \"output\": the language of this question's code, when it differs from the quiz's."
          },
          "options": {
            "type": "array",
            "items": {
              "type": "string"
            },
            "minItems": 2,
            "description": "Choices for \"choice\", or for \"output\" when the student picks instead of typing."
          },
          "answer": {
            "description": "The right answer; its form depends on \"type\".",
            "anyOf": [
              {
                "type": "integer",
                "minimum": 0
              },
              {
                "type": "array",
                "items": {
                  "type": "integer",
                  "minimum": 0
                },
                "minItems": 1
              },
              {
                "type": "boolean"
              },
              {
                "type": "string"
              },
              {
                "type": "array",
                "items": {
                  "type": "string"
                },
                "minItems": 1
              }
            ]
          },
          "caseSensitive": {
            "type": "boolean",
            "default": false,
            "description": "\"short\" only: compare letter case too."
          },
          "base": {
            "enum": [
              2,
              8,
              10,
              16
            ],
            "default": 10,
            "description": "For \"number\" questions: the base the answer is written in. Students may type prefixes (0b, 0o, 0x), spaces and leading zeros."
          },
          "tolerance": {
            "type": "number",
            "minimum": 0,
            "default": 0,
            "description": "For \"number\" questions in base 10: how far the student's answer may be from \"answer\" (for decimals, e.g. 0.01)."
          },
          "explanation": {
            "type": "string",
            "description": "Shown after a practice check (Markdown). Never shown during an exam."
          },
          "points": {
            "type": "number",
            "exclusiveMinimum": 0,
            "default": 1,
            "description": "Points for this question (all or nothing)."
          }
        },
        "additionalProperties": false
      }
    },
    "translations": {
      "type": "object",
      "description": "Translations, by language (for example \"pt-br\"). Answers stay the same; for short answers you can add accepted answers in the other language.",
      "patternProperties": {
        "^[a-z]{2}(-[a-z]{2})?$": {
          "type": "object",
          "additionalProperties": false,
          "properties": {
            "title": {
              "type": "string"
            },
            "description": {
              "type": "string"
            },
            "questions": {
              "type": "array",
              "description": "One entry per question, in the same order.",
              "items": {
                "type": "object",
                "additionalProperties": false,
                "properties": {
                  "prompt": {
                    "type": "string"
                  },
                  "explanation": {
                    "type": "string"
                  },
                  "options": {
                    "type": "array",
                    "items": {
                      "type": "string"
                    },
                    "description": "For \"choice\" questions: the options in the same order. Options of \"output\" questions are program output and are never translated."
                  },
                  "answer": {
                    "description": "For \"short\" questions: extra accepted answers in this language.",
                    "anyOf": [
                      {
                        "type": "string"
                      },
                      {
                        "type": "array",
                        "items": {
                          "type": "string"
                        }
                      }
                    ]
                  }
                }
              }
            }
          }
        }
      },
      "additionalProperties": false
    }
  }
}
