{
  "title": "Bits and Bytes Quiz",
  "topic": "BitsBytes",
  "requires": [
    "Basics"
  ],
  "description": "How much fits in a number of bits, sizes in SI and binary units, bits versus bytes, and byte order.",
  "questions": [
    {
      "type": "number",
      "prompt": "How many different values can **10 bits** hold?",
      "answer": "1024",
      "explanation": "Each bit doubles the count: 2¹⁰ = 1024."
    },
    {
      "type": "number",
      "prompt": "What is the largest number **16 bits** can store, counting from 0?",
      "answer": "65535",
      "explanation": "16 bits hold 2¹⁶ = 65,536 values, from 0 to 65,535. Answering 65,536 is the classic off-by-one."
    },
    {
      "type": "number",
      "prompt": "How many bits do you need to write **300** in binary?",
      "answer": "9",
      "explanation": "8 bits only reach 255, and 9 bits reach 511, so 300 needs 9 bits (`100101100`)."
    },
    {
      "type": "number",
      "prompt": "How many bytes are there in one **KiB** (kibibyte)?",
      "answer": "1024",
      "explanation": "Binary prefixes multiply by 1024 = 2¹⁰: 1 KiB = 1024 bytes, 1 MiB = 1024 KiB."
    },
    {
      "type": "choice",
      "prompt": "A disk sold as **1 TB** shows up as about **931 GB** on Windows. Why?",
      "options": [
        "Part of the disk is broken",
        "The disk maker counts in powers of 1000, and Windows divides by 1024 (it shows GiB, calling them GB)",
        "The operating system uses 69 GB",
        "Files are compressed"
      ],
      "answer": 1,
      "explanation": "1 TB = 1,000,000,000,000 bytes. Divided by 1024³ that is 931.3 GiB. Nothing is missing: the same bytes are counted with a bigger unit."
    },
    {
      "type": "number",
      "prompt": "A memory card is sold as **4 GB** (SI). About how many **GiB** is that? Answer with 2 decimals.",
      "answer": "3.73",
      "explanation": "4 × 1000³ ÷ 1024³ = 3.725…, about 3.73 GiB.",
      "tolerance": 0.01
    },
    {
      "type": "number",
      "prompt": "An internet connection of **80 Mbps** downloads how many **megabytes** per second, at most?",
      "answer": "10",
      "explanation": "Speeds are in bits: 80 megabits per second ÷ 8 bits per byte = 10 megabytes per second."
    },
    {
      "type": "number",
      "prompt": "Two bytes stored **little-endian** are `2C 01`. Which number do they store?",
      "answer": "300",
      "explanation": "Little-endian puts the least significant byte first: 0x012C = 1 × 256 + 44 = 300. Reading them big-endian would give 0x2C01 = 11,265."
    },
    {
      "type": "truefalse",
      "prompt": "A Java `int` always uses 32 bits, on any computer.",
      "answer": true,
      "explanation": "Java fixes the sizes: `byte` 8 bits, `short` 16, `int` 32, `long` 64. That is why an `int` stops at 2,147,483,647."
    },
    {
      "type": "output",
      "code": "IO.println(1024 * 1024);",
      "answer": "1048576",
      "explanation": "1024 × 1024 = 1,048,576: the number of bytes in one MiB."
    }
  ],
  "translations": {
    "pt-br": {
      "title": "Quiz de bits e bytes",
      "description": "Quanto cabe numa quantidade de bits, tamanhos em unidades SI e binárias, bits versus bytes, e a ordem dos bytes.",
      "questions": [
        {
          "prompt": "Quantos valores diferentes **10 bits** conseguem guardar?",
          "explanation": "Cada bit dobra a quantidade: 2¹⁰ = 1024."
        },
        {
          "prompt": "Qual é o maior número que **16 bits** conseguem guardar, contando a partir de 0?",
          "explanation": "16 bits guardam 2¹⁶ = 65.536 valores, de 0 a 65.535. Responder 65.536 é o erro clássico de um a mais."
        },
        {
          "prompt": "Quantos bits são necessários para escrever **300** em binário?",
          "explanation": "8 bits só chegam a 255, e 9 bits chegam a 511, então 300 precisa de 9 bits (`100101100`)."
        },
        {
          "prompt": "Quantos bytes há em um **KiB** (kibibyte)?",
          "explanation": "Os prefixos binários multiplicam por 1024 = 2¹⁰: 1 KiB = 1024 bytes, 1 MiB = 1024 KiB."
        },
        {
          "prompt": "Um disco vendido como **1 TB** aparece com cerca de **931 GB** no Windows. Por quê?",
          "options": [
            "Parte do disco está com defeito",
            "O fabricante conta em potências de 1000, e o Windows divide por 1024 (mostra GiB, chamando de GB)",
            "O sistema operacional usa 69 GB",
            "Os arquivos são comprimidos"
          ],
          "explanation": "1 TB = 1.000.000.000.000 bytes. Dividido por 1024³ dá 931,3 GiB. Nada sumiu: os mesmos bytes são contados com uma unidade maior."
        },
        {
          "prompt": "Um cartão de memória é vendido como **4 GB** (SI). Quantos **GiB** são, mais ou menos? Responda com 2 casas decimais.",
          "explanation": "4 × 1000³ ÷ 1024³ = 3,725…, cerca de 3,73 GiB."
        },
        {
          "prompt": "Uma conexão de internet de **80 Mbps** baixa no máximo quantos **megabytes** por segundo?",
          "explanation": "Velocidades são em bits: 80 megabits por segundo ÷ 8 bits por byte = 10 megabytes por segundo."
        },
        {
          "prompt": "Dois bytes guardados em **little-endian** são `2C 01`. Que número eles guardam?",
          "explanation": "O little-endian coloca o byte menos significativo primeiro: 0x012C = 1 × 256 + 44 = 300. Lidos em big-endian, dariam 0x2C01 = 11.265."
        },
        {
          "prompt": "Um `int` do Java sempre usa 32 bits, em qualquer computador.",
          "explanation": "O Java fixa os tamanhos: `byte` 8 bits, `short` 16, `int` 32, `long` 64. É por isso que um `int` para em 2.147.483.647."
        },
        {
          "explanation": "1024 × 1024 = 1.048.576: a quantidade de bytes em um MiB."
        }
      ]
    }
  }
}
