{
  "title": "Logic and Bitwise Quiz",
  "topic": "Logic",
  "requires": [
    "Conditionals"
  ],
  "description": "Logic gates, truth tables, De Morgan, adding with gates and bit masks.",
  "questions": [
    {
      "type": "choice",
      "prompt": "Which gate has this truth table?\n\n| A | B | OUT |\n|---|---|-----|\n| 0 | 0 | 0 |\n| 0 | 1 | 1 |\n| 1 | 0 | 1 |\n| 1 | 1 | 0 |",
      "options": [
        "AND",
        "OR",
        "XOR",
        "NAND"
      ],
      "answer": 2,
      "explanation": "The output is 1 exactly when the inputs differ: that is XOR. OR would also give 1 for 1 and 1."
    },
    {
      "type": "choice",
      "prompt": "Which expression is the same as `!(a && b)`?",
      "options": [
        "`!a && !b`",
        "`!a || !b`",
        "`a || b`",
        "`!a ^ b`"
      ],
      "answer": 1,
      "explanation": "De Morgan's law: NOT (A AND B) = (NOT A) OR (NOT B). \"Not both\" means \"at least one is false\"."
    },
    {
      "type": "number",
      "prompt": "A half adder gets **A = 1** and **B = 1**. What does its **sum** output (XOR) give?",
      "answer": "0",
      "explanation": "1 + 1 = 10 in binary: the sum bit is 0 and the carry (AND) is 1."
    },
    {
      "type": "choice",
      "prompt": "Which expression turns **off** bit 3 of `n`, leaving the other bits as they are?",
      "options": [
        "`n | 8`",
        "`n & ~8`",
        "`n ^ 8`",
        "`n & 8`"
      ],
      "answer": 1,
      "explanation": "8 is 1 << 3. ~8 has every bit on except bit 3, so AND keeps everything else and clears bit 3. `n ^ 8` would turn it on if it was off."
    },
    {
      "type": "output",
      "code": "IO.println(12 & 10);",
      "answer": "8",
      "explanation": "1100 & 1010 = 1000: only the bit that is 1 in both stays."
    },
    {
      "type": "output",
      "code": "IO.println(12 ^ 10);",
      "answer": "6",
      "explanation": "1100 ^ 1010 = 0110: the bits where they differ."
    },
    {
      "type": "output",
      "code": "IO.println(3 << 4);",
      "answer": "48",
      "explanation": "Each shift to the left doubles: 3 × 2⁴ = 48."
    },
    {
      "type": "output",
      "code": "IO.println(-16 >> 2);",
      "answer": "-4",
      "explanation": ">> keeps the sign bit, so shifting right twice divides by 4. (>>> would shift in zeros and give a huge positive number.)"
    },
    {
      "type": "number",
      "prompt": "A file has permissions **rwx** for the owner. You remove write with `p & ~2`. Which digit is left?",
      "answer": "5",
      "explanation": "rwx is 4 + 2 + 1 = 7. Clearing the write bit (2) leaves 4 + 1 = 5, which is r-x."
    },
    {
      "type": "truefalse",
      "prompt": "A parity bit can detect when **two** bits of a byte flip on the way.",
      "answer": false,
      "explanation": "Two flips keep the number of 1s even (or odd), so the parity still matches. A parity bit only catches an odd number of flipped bits."
    }
  ],
  "translations": {
    "pt-br": {
      "title": "Quiz de lógica e operações bit a bit",
      "description": "Portas lógicas, tabelas-verdade, De Morgan, somar com portas e máscaras de bits.",
      "questions": [
        {
          "prompt": "Qual porta tem esta tabela-verdade?\n\n| A | B | OUT |\n|---|---|-----|\n| 0 | 0 | 0 |\n| 0 | 1 | 1 |\n| 1 | 0 | 1 |\n| 1 | 1 | 0 |",
          "options": [
            "AND",
            "OR",
            "XOR",
            "NAND"
          ],
          "explanation": "A saída é 1 exatamente quando as entradas são diferentes: é o XOR. O OR também daria 1 para 1 e 1."
        },
        {
          "prompt": "Qual expressão é igual a `!(a && b)`?",
          "options": [
            "`!a && !b`",
            "`!a || !b`",
            "`a || b`",
            "`!a ^ b`"
          ],
          "explanation": "Lei de De Morgan: NOT (A AND B) = (NOT A) OR (NOT B). \"Não os dois\" quer dizer \"pelo menos um é falso\"."
        },
        {
          "prompt": "Um meio somador recebe **A = 1** e **B = 1**. O que a saída de **soma** (XOR) dá?",
          "explanation": "1 + 1 = 10 em binário: o bit da soma é 0 e o vai-um (AND) é 1."
        },
        {
          "prompt": "Qual expressão **desliga** o bit 3 de `n`, deixando os outros bits como estão?",
          "options": [
            "`n | 8`",
            "`n & ~8`",
            "`n ^ 8`",
            "`n & 8`"
          ],
          "explanation": "8 é 1 << 3. ~8 tem todos os bits ligados menos o bit 3, então o AND mantém todo o resto e desliga o bit 3. `n ^ 8` o ligaria se estivesse desligado."
        },
        {
          "explanation": "1100 & 1010 = 1000: só fica o bit que é 1 nos dois."
        },
        {
          "explanation": "1100 ^ 1010 = 0110: os bits em que eles diferem."
        },
        {
          "explanation": "Cada deslocamento para a esquerda dobra: 3 × 2⁴ = 48."
        },
        {
          "explanation": ">> mantém o bit de sinal, então deslocar duas vezes para a direita divide por 4. (>>> colocaria zeros e daria um número positivo enorme.)"
        },
        {
          "prompt": "Um arquivo tem permissões **rwx** para o dono. Você tira a escrita com `p & ~2`. Qual dígito sobra?",
          "explanation": "rwx é 4 + 2 + 1 = 7. Desligar o bit de escrita (2) deixa 4 + 1 = 5, que é r-x."
        },
        {
          "prompt": "Um bit de paridade consegue detectar quando **dois** bits de um byte mudam no caminho.",
          "explanation": "Duas mudanças mantêm o número de 1s par (ou ímpar), então a paridade continua batendo. Um bit de paridade só pega um número ímpar de bits trocados."
        }
      ]
    }
  }
}
